{
  "schema_version": "w2-draft-v1",
  "name": "recipe-heavy-b",
  "version": "0.1.0",
  "site_id": "lab-only",
  "station_id": "station-sim",
  "package": {
    "name": "model-heavy-b",
    "version": "0.1.0",
    "manifest_sha256": "20c43097224beb7fc11d97a3eab3005918e9c241b4c24fb1ceda691187b937d7"
  },
  "decision": {
    "rule": "score-gte-threshold-is-ng",
    "threshold": 0.5
  },
  "rollback_recipe": {
    "name": "recipe-a",
    "version": "0.1.0",
    "sha256": "de9871c469e04977f5e85df5941412f35f3193d091523ee842da0b3a6de33677"
  }
}
