{
  "schema_version": "w2-draft-v1",
  "name": "recipe-vram",
  "version": "0.1.0",
  "site_id": "lab-only",
  "station_id": "station-sim",
  "package": {
    "name": "model-vram",
    "version": "0.1.0",
    "manifest_sha256": "5ee7860c2b866a988574c1eefe407c787858ddd43a2bfc788a01a9e71b0ff1ea"
  },
  "decision": {
    "rule": "score-gte-threshold-is-ng",
    "threshold": 0.5
  },
  "rollback_recipe": {
    "name": "recipe-a",
    "version": "0.1.0",
    "sha256": "de9871c469e04977f5e85df5941412f35f3193d091523ee842da0b3a6de33677"
  }
}
